{
  "$schema": "https://json-schema.org/draft/2020-12/schema",
  "$id": "schemas/state-v2.schema.json",
  "type": "object",
  "additionalProperties": false,
  "required": ["schema_version", "producer_version", "effective_limits", "inputs", "derivations", "artifacts", "completion", "skipped_scopes"],
  "properties": {
    "schema_version": {"const": 2},
    "producer_version": {"type": "string", "minLength": 1},
    "configuration": {"$ref": "#/$defs/configuration"},
    "effective_limits": {"type": "array", "minItems": 7, "maxItems": 7, "items": {"$ref": "#/$defs/limit"}},
    "inputs": {"type": "array", "items": {"$ref": "#/$defs/input"}},
    "derivations": {"type": "array", "items": {"$ref": "#/$defs/derivation"}},
    "artifacts": {"type": "array", "items": {"$ref": "#/$defs/artifact"}},
    "completion": {"enum": ["complete", "partial"]},
    "skipped_scopes": {"type": "array", "items": {"$ref": "#/$defs/skipped_scope"}}
  },
  "$defs": {
    "digest": {"type": "string", "pattern": "^[0-9a-f]{64}$"},
    "location": {"type": "string", "minLength": 1, "pattern": "^(?!/)(?!.*(?:^|/)\\.\\.?/)(?!.*\\\\)(?!.*\\u0000).+$"},
    "configuration": {"type": "object", "additionalProperties": false, "required": ["location", "sha256"], "properties": {"location": {"$ref": "#/$defs/location"}, "sha256": {"$ref": "#/$defs/digest"}}},
    "limit_value": {"oneOf": [{"type": "integer", "minimum": 1}, {"const": "unlimited"}]},
    "limit": {"type": "object", "additionalProperties": false, "required": ["name", "default", "requested", "effective", "source"], "properties": {"name": {"type": "string"}, "default": {"type": "integer", "minimum": 1}, "requested": {"$ref": "#/$defs/limit_value"}, "effective": {"$ref": "#/$defs/limit_value"}, "source": {"enum": ["default", "configuration", "invocation"]}}},
    "input": {"type": "object", "additionalProperties": false, "required": ["id", "source_kind", "location", "sha256", "rule_id", "rule_version"], "properties": {"id": {"type": "string", "minLength": 1}, "source_kind": {"type": "string", "minLength": 1}, "location": {"$ref": "#/$defs/location"}, "locator": {"type": "string", "minLength": 1}, "sha256": {"$ref": "#/$defs/digest"}, "value_sha256": {"$ref": "#/$defs/digest"}, "rule_id": {"type": "string", "minLength": 1}, "rule_version": {"type": "integer", "minimum": 1}}},
    "evidence_ids": {"type": "array", "items": {"type": "string", "minLength": 1}, "uniqueItems": true},
    "derivation": {"type": "object", "additionalProperties": false, "required": ["subject_id", "claim_code", "classification", "evidence_ids"], "properties": {"subject_id": {"type": "string", "minLength": 1}, "claim_code": {"type": "string", "minLength": 1}, "classification": {"enum": ["verified", "inferred", "recommended", "unknown"]}, "evidence_ids": {"$ref": "#/$defs/evidence_ids"}}},
    "artifact": {"type": "object", "additionalProperties": false, "required": ["location", "sha256", "evidence_ids", "ownership"], "properties": {"location": {"$ref": "#/$defs/location"}, "sha256": {"$ref": "#/$defs/digest"}, "evidence_ids": {"$ref": "#/$defs/evidence_ids"}, "ownership": {"enum": ["document", "section"]}}},
    "skipped_scope": {"type": "object", "additionalProperties": false, "required": ["scope", "reason", "omitted_scope"], "properties": {"scope": {"$ref": "#/$defs/location"}, "reason": {"type": "string", "minLength": 1}, "effective_limit": {"type": "integer", "minimum": 1}, "consumed": {"type": "integer", "minimum": 0}, "omitted_scope": {"type": "string", "minLength": 1}}}
  }
}
