{
  "schema_version": 2,
  "producer_version": "1.0.0rc1",
  "effective_limits": [
    {"name": "max_depth", "default": 256, "requested": 256, "effective": 256, "source": "default"},
    {"name": "max_entries", "default": 1000000, "requested": 1000000, "effective": 1000000, "source": "default"},
    {"name": "max_file_bytes", "default": 268435456, "requested": 268435456, "effective": 268435456, "source": "default"},
    {"name": "max_total_bytes", "default": 17179869184, "requested": 17179869184, "effective": 17179869184, "source": "default"},
    {"name": "max_elapsed_seconds", "default": 1800, "requested": 1800, "effective": 1800, "source": "default"},
    {"name": "max_open_files", "default": 256, "requested": 256, "effective": 256, "source": "default"},
    {"name": "max_memory_bytes", "default": 2147483648, "requested": 2147483648, "effective": 2147483648, "source": "default"}
  ],
  "inputs": [],
  "derivations": [],
  "artifacts": [],
  "completion": "complete",
  "skipped_scopes": []
}
